{
  "id": "furnace_glow",
  "description": "Heat pouring out of a furnace mouth (M2-10): sparks spat out and up, a thin dark smoke and a hot, slowly breathing light on the ground in front of it.",
  "offset": [0, 0.9, 0],
  "embers": {
    "count": 12,
    "lifetime_s": 1.2,
    "radius_m": 0.35,
    "rise_mps": [1.0, 2.0],
    "spread_deg": 35,
    "buoyancy": 0.25,
    "damping": 0.35,
    "size_m": 0.045,
    "color": [1.0, 0.6, 0.2, 1.0]
  },
  "light": {
    "color": [1.0, 0.45, 0.14],
    "energy": 3.0,
    "range_m": 10.0,
    "attenuation": 1.3,
    "fog_energy": 1.0,
    "y_m": 0.0,
    "flicker": {"amount": 0.12, "speed_hz": 0.8}
  }
}
